comment_id,article_id,comment_author,comment_datetime_displayed,comment_datetime,comment_content,comment_in_answer_to,comment_likes,comment_dislikes
DI20240924130700-16378973,DI20240924130700,Ja seria hora,"9/24/2024, 4:26:01 AM",2024-09-24 04:26:01,"Ja seria hora de aturar aquesta bogeria de immigració que apart de fer DESPLOMAR salaris, donar un servei inexistent amb català, bloquejar feina per la gent d'aquí I tensionar al màxim el tema habitatge no aportar cap valor afegit, prou desnonats sense cap formació i comenceu a pensar amb ingenyiers, investigadors, tècnics etc si voleu que empreses tecnològiques vinguin aquí",,,
DI20240924130700-16378952,DI20240924130700,Carles,"9/24/2024, 4:21:27 AM",2024-09-24 04:21:27,"Molt bona iniciativa, aixi evitem que colectius passin com ha passat a doblar-se en menys d'un any ",,,
DI20240924130700-16382217,DI20240924130700,Andorra,"9/24/2024, 8:55:31 AM",2024-09-24 08:55:31,+1,16378952,,
DI20240924120500-16379750,DI20240924120500,Dos hipoteques,"9/24/2024, 5:40:26 AM",2024-09-24 05:40:26,400.000 d'hipoteca + 400.000 d'interès ,,,
DI20240924120500-16379399,DI20240924120500,Rafa,"9/24/2024, 5:09:00 AM",2024-09-24 05:09:00,Quina barbaritat aquest deute,,,
DI20240924120500-16376518,DI20240924120500,Molt maco,"9/23/2024, 10:17:12 PM",2024-09-23 22:17:12,A quan surt la quota mensual? Xk molta gent la.paga del ingres de tenir un pis turistic,,,
DI20240924065000-16378108,DI20240924065000,Realisme o intel-ligència,"9/24/2024, 2:24:54 AM",2024-09-24 02:24:54,Seria bo que el Govern proposés polítiques de l'habitatge després de conèixer la seva realitat  i no pas improvisar com ara amb fins demagògics o electoralistes.,,,
DI20240924061000-16389442,DI20240924061000,Peret dels bous,"9/25/2024, 12:10:49 AM",2024-09-25 00:10:49,"Doncs aquí els tens, son gent formada, tots dos son arquitectes i en lavaquiol es enginyer, potser necessitem escoltar-los i no criticar tant...!!",,,
DI20240924061000-16385640,DI20240924061000,Victimes ?,"9/24/2024, 1:47:03 PM",2024-09-24 13:47:03,O sigui que tota aquesta regio ha profitat de la situacio economica qu'Andorra ha aportat durant decades I ara protesten I es fan les victimes ? ,,,
DI20240924061000-16385715,DI20240924061000,Residències fiscals,"9/24/2024, 1:55:27 PM",2024-09-24 13:55:27,"Són víctimes d'ells mateixos, per no aplicar les seves lleis.",16385640,,
DI20240924061000-16390200,DI20240924061000,¡,"9/25/2024, 2:10:58 AM",2024-09-25 02:10:58,+1,16385715,,
DI20240924061000-16385523,DI20240924061000,Pichapins comunistes,"9/24/2024, 1:35:32 PM",2024-09-24 13:35:32,Perroflautes que voten a la cup…res més…,,,
DI20240924061000-16389482,DI20240924061000,Peret dels bous,"9/25/2024, 12:15:46 AM",2024-09-25 00:15:46,Dos arquitectes i un enginyer de moment....,16385523,,
DI20240924061000-16383068,DI20240924061000,Josep,"9/24/2024, 10:07:15 AM",2024-09-24 10:07:15,"Per molta música celestial i poesia que alguns ens volen fer escoltar, l'Alt d'Urgell (pel moment) no és la vuitena parròquia d'Andorra. ",,,
DI20240924061000-16383884,DI20240924061000,Haha,"9/24/2024, 11:19:21 AM",2024-09-24 11:19:21,"Tots els andorrans hi anirien a viuse si fos andorra, mes bones vistes millor riu, mes serveis... si no van es x no perdre la.fiscalitat pero tots sabem k de les 7 parroquies 6 son molt pitjors que la seu x viure",16383068,,
DI20240924061000-16384116,DI20240924061000,Josep,"9/24/2024, 11:38:41 AM",2024-09-24 11:38:41,"No, no, si ho dic precisament per la quantitat d'andorrans que hi dormen...",16383884,,
DI20240924061000-16383570,DI20240924061000,Arnau,"9/24/2024, 10:48:12 AM",2024-09-24 10:48:12,Que més voldrien ells que ser-ho,16383068,,
DI20240924061000-16382601,DI20240924061000,Xaquiros,"9/24/2024, 9:24:41 AM",2024-09-24 09:24:41,"Amb els diners que't costa un estudi o un pis d'una habitació a Andorra, et compres o llogues  un pis de quatre habitacions o una casa a l'Alt d'Urgell, fent veure que vius a Andorra a la teva antiga residència o a casa d'algun amic i familiar, passant cada dia la frontera per anar a treballar, i com això no ho controla ni déu, doncs vas fent i qui dia passa, any empeny. ",,,
DI20240924061000-16383560,DI20240924061000,Quina enveja,"9/24/2024, 10:47:35 AM",2024-09-24 10:47:35,controla't la teva pobra vida i la teva ment tan destrossada deixa estar als demes i viu una mica si ets capaç,16382601,,
DI20240924061000-16382599,DI20240924061000,Lluis,"9/24/2024, 9:24:27 AM",2024-09-24 09:24:27,Talleu l’aigua i que aquests catalans sols beguin cocacola ,,,
DI20240924061000-16383053,DI20240924061000,calla,"9/24/2024, 10:05:58 AM",2024-09-24 10:05:58,Talleu també les carreteres habiam per on surten,16382599,,
DI20240924061000-16383031,DI20240924061000,curtet.,"9/24/2024, 10:04:39 AM",2024-09-24 10:04:39,"Ruc si no tens ni la farina per fer el pa que menges cada dia, que ignorant !!!!",16382599,,
DI20240924061000-16383761,DI20240924061000,Albert,"9/24/2024, 11:07:23 AM",2024-09-24 11:07:23,Per això tenim sortida per França que tampoc us estimen gaire ,16383031,,
DI20240924061000-16382529,DI20240924061000,Les coses pel seu nom,"9/24/2024, 9:17:10 AM",2024-09-24 09:17:10,La vivienda a la Seu es cara per culpa de les falses residències i el frau fiscal. ,,,
DI20240924061000-16382600,DI20240924061000,.,"9/24/2024, 9:24:40 AM",2024-09-24 09:24:40,+10👌,16382529,,
DI20240924061000-16382189,DI20240924061000,Trampes al solitari,"9/24/2024, 8:52:56 AM",2024-09-24 08:52:56,"Els impostos s'han de pagar on es viu, no on ho fas veure.",,,
DI20240924061000-16382076,DI20240924061000,Blanc i en botella,"9/24/2024, 8:43:33 AM",2024-09-24 08:43:33,"El veritable problema radica en les dobles nacionalitats (Andorra no ho permet), i les dobles residències fiscals. ",,,
DI20240924061000-16381890,DI20240924061000,Quim Valera,"9/24/2024, 8:30:44 AM",2024-09-24 08:30:44,"Alguns portem anys picant pedra per unir i crear sinèrgies entre pirinencs, i mentre que alguns il·luminats s'ho volen carregar amb arguments netament demagògics... Quina pena.",,,
DI20240924061000-16383923,DI20240924061000,Loosers de poble,"9/24/2024, 11:22:50 AM",2024-09-24 11:22:50,Això se pirinencs només ho diuen a La Seu.,16381890,,
DI20240924061000-16389474,DI20240924061000,Peret dels bous,"9/25/2024, 12:14:42 AM",2024-09-25 00:14:42,"Si, personalitat pròpia; contraban, diner negre, societat hiperconsumista, urbanisme inexistent, trànsit insuportable, comerç desmesurat, arrogància, etc etc",16383923,,
DI20240924061000-16382109,DI20240924061000,Fàcil d'entendre,"9/24/2024, 8:46:40 AM",2024-09-24 08:46:40,"Quim, és tan simple com pagar els impostos on veritablement vius.",16381890,,
DI20240924061000-16380644,DI20240924061000,Vililla,"9/24/2024, 6:57:15 AM",2024-09-24 06:57:15,Culpar a los demás de tus problemas donde lo he visto.. a si en todos los regímenes populistas y dictaduras ,,,
DI20240924061000-16380975,DI20240924061000,Rafa,"9/24/2024, 7:20:22 AM",2024-09-24 07:20:22,Lo habrás visto en la cloaca donde trabajas te veo muy bien informada en el tema,16380644,,
DI20240924061000-16380624,DI20240924061000,Abril,"9/24/2024, 6:55:38 AM",2024-09-24 06:55:38,"Amic crespo serà talla carreteres , cup etc etc , amb aquet element , tot va per qui Andorra aquet bragueta",,,
DI20240924061000-16380544,DI20240924061000,pi,"9/24/2024, 6:48:54 AM",2024-09-24 06:48:54,Tants comentaris per 4 gats mal pentinats que no saben ni caçar un ratolí...,,,
DI20240924061000-16380099,DI20240924061000,CONXI,"9/24/2024, 6:09:05 AM",2024-09-24 06:09:05,en 3.2.1. li queda poc al ESCLAT i al aldi  de la seu..forever MERCADONA 💘,,,
DI20240924061000-16379938,DI20240924061000,Falses residències fiscals,"9/24/2024, 5:56:57 AM",2024-09-24 05:56:57,"Podrien expropiar els pisos i cases a tots els delinqüents fiscals que fa anys i panys resideixen a l'Alt d'Urgell sense pagar els impostos, i així tindries dos solucions en una.",,,
DI20240924061000-16378989,DI20240924061000,Urgellenc,"9/24/2024, 4:27:14 AM",2024-09-24 04:27:14,"Al final són gent amb poca feina i ganes de protagonisme que no ha tingut mai ni amb els amics, gent frustrada i poc treballadora, fa dies que sabem qui sou, però si no fos per Andorra i una mica Piugcerda ens morirem de gana, sou una vergonya per nosaltres, andorrans ni cas, molts de nosaltres som família o amics, aquests no son ningú.",,,
DI20240924061000-16380670,DI20240924061000,Albert,"9/24/2024, 6:59:01 AM",2024-09-24 06:59:01,"Ningú s’ha ficat amb els andorrans, tot lo contrari a lo que vostè fa!! ",16378989,,
DI20240924061000-16382572,DI20240924061000,Urgellenc,"9/24/2024, 9:21:50 AM",2024-09-24 09:21:50,Qui diu que no els conec ? Tu ? Treballadors sense ganes son !!!!,16380670,,
DI20240924061000-16378642,DI20240924061000,mas,"9/24/2024, 3:41:07 AM",2024-09-24 03:41:07,ni cas   DA  li esteu  donant massa repercucio a 3 gats,,,
DI20240924061000-16378519,DI20240924061000,Tret per la culata,"9/24/2024, 3:24:37 AM",2024-09-24 03:24:37,Ningú en parla de les inversions andorranes a l'Alt Urgell? De les empreses adquirides els darrers anys per capital d'andorrans? Això no dona vida a la comarca? I feina als urgellencs? Crec que aquest moviment no apunta correctament. Els falten dades i els sobren percepcions equivocades.,,,
DI20240924061000-16378455,DI20240924061000,TRAMVIA BLAU,"9/24/2024, 3:14:16 AM",2024-09-24 03:14:16,Tindria que caure una bomba atómica.Fot fastic el mon.,,,
DI20240924061000-16378369,DI20240924061000,Chad Redpilled Jr.,"9/24/2024, 3:02:42 AM",2024-09-24 03:02:42,"“Pirineu Viu està formada per diverses associacions veïnals, col·lectius ecofeministes, sindicats laborals, casals i ateneus de poble, etc.”",,,
DI20240924061000-16381435,DI20240924061000,Mondongo,"9/24/2024, 7:56:27 AM",2024-09-24 07:56:27,"Que dius gent gens recomanable son la bomba jo conec a unes cuantes com: Ecofeminista empoderada nivell deessa Gaia,  Caçadora de plàstics, Vegana ninja de la permacultura, Coach fitness de la Mare Terra Totes són molt bones noies i mai, mai, et fan saber la seva opinió a la força... o gairebé!",16378369,,
DI20240924061000-16380743,DI20240924061000,Albert,"9/24/2024, 7:02:34 AM",2024-09-24 07:02:34,Vostè si que està carregat de odi i molt avorrit a la seva vida!!! ,16378369,,
DI20240924061000-16378518,DI20240924061000,ja te vale,"9/24/2024, 3:24:34 AM",2024-09-24 03:24:34,L'odi només és teu!!,16378369,,
DI20240924061000-16380697,DI20240924061000,Vililla,"9/24/2024, 7:00:17 AM",2024-09-24 07:00:17,Mmm.. no,16378518,,
DI20240924061000-16378241,DI20240924061000,Paga on vius,"9/24/2024, 2:44:06 AM",2024-09-24 02:44:06,"Si voleu pisos barats, controleu la delinqüència fiscal.",,,
DI20240924061000-16378698,DI20240924061000,Guineus,"9/24/2024, 3:49:17 AM",2024-09-24 03:49:17,+10👌,16378241,,
DI20240924061000-16378222,DI20240924061000,Iep,"9/24/2024, 2:41:27 AM",2024-09-24 02:41:27,Sóc andorrà i si... Andorra fot fàstic!,,,
DI20240924061000-16378164,DI20240924061000,Desertificació pallaresa,"9/24/2024, 2:33:27 AM",2024-09-24 02:33:27,Acabem doncs com al Pallars desertat pels seus habitants per anar a buscar feina a les capitals.,,,
DI20240924061000-16378125,DI20240924061000,Andorrà,"9/24/2024, 2:27:41 AM",2024-09-24 02:27:41,Tenen tota la raó.,,,
DI20240924061000-16378047,DI20240924061000,Cito,"9/24/2024, 2:15:55 AM",2024-09-24 02:15:55,Molt protestar molt donar la culpa als altres però quin model proposen ? Quin futur per el territori volen ? Com pretenen ser un territori atractiu per a joves emprenedors que creïn llocs de treball ? Molt Bla bla bla i cap proposta ,,,
DI20240924061000-16379425,DI20240924061000,Milton d’Areny-Plandolit,"9/24/2024, 5:11:18 AM",2024-09-24 05:11:18,"El model que proposen és el model sinistre i fracassat de sempre: socialisme, col·lectivitzacions, comunisme, la mateixa basura ideològica que tantes vegades ha estat demostrada com a equivocada, fracassada i causant de pobresa, mort i opressió. A Europa de l’Est, que ho van patir de primera mà, ho tenen ben clar. Comunisme mai més!",16378047,,
DI20240924061000-16382716,DI20240924061000,Pensa i raona,"9/24/2024, 9:36:13 AM",2024-09-24 09:36:13,Encara no has entès que tot forma part de la mateixa ideologia?,16379425,,
DI20240924061000-16381900,DI20240924061000,El Keynes d'Organyà,"9/24/2024, 8:31:32 AM",2024-09-24 08:31:32,"Pobre...quines obsessions tens, només et falta esmentar la francmasoneria i la prensa canallesca",16379425,,
DI20240924061000-16382842,DI20240924061000,El hayek de la seu,"9/24/2024, 9:46:50 AM",2024-09-24 09:46:50,"Doncs el capitalista Milton té tota la raó. Tota aquesta gent es presenten com a “moviments socials” en el fons amaguen pulsions col·lectivitzadores i contràries a les llibertats individuals, esquerra de la més rància i casposa, en fi, que al final sempre se sap de que plora la criatura. ",16381900,,
DI20240924061000-16378167,DI20240924061000,Albert,"9/24/2024, 2:34:02 AM",2024-09-24 02:34:02,"Si no els vols ni escoltar, et fan ràbia perquè son diferents a tu i tsmbe pensen diferent.",16378047,,
DI20240924061000-16379403,DI20240924061000,Milton d’Areny-Plandolit,"9/24/2024, 5:09:15 AM",2024-09-24 05:09:15,"Heu fracassat en tot, al 1991, amb la caiguda de la URSS us vam clavar una pallissa històrica i humiliant i des d’aleshores els comunistes heu anat sense rumb, com pollastres sense cap. La vostra ideologia negasta i fracassada només ha dut que pobresa, destrucció i mort i no en tinguis cap mena de dubte que a Andorra i arreu us tornarem a vèncer tantes vegades com calgui.",16378167,,
DI20240924061000-16380783,DI20240924061000,Albert,"9/24/2024, 7:05:13 AM",2024-09-24 07:05:13,"No perdona, jo no he fracassat amb res!!",16379403,,
DI20240924061000-16381137,DI20240924061000,Milton d’Areny-Plandolit,"9/24/2024, 7:33:55 AM",2024-09-24 07:33:55,"Sí, Albert, has fracassat, la teva ideologia esquerrosa ha fracassat, i quan dic que us vam clavar una pallissa el 1991, vull dir que vam derrotar el comunisme i tota la porqueria ideològica associada, que hom li pot canviar el nom per vendre-ho millor a quatre il·lusos (Eco-feminisme, anti-imperialisme, poder popular, justícia social…) però si bé amb un altra cara, és la mateixa merda que vam derrotar al 91.",16380783,,
DI20240924061000-16381744,DI20240924061000,Ramon,"9/24/2024, 8:19:28 AM",2024-09-24 08:19:28,"Au, vés a demanar diners al papa.",16381137,,
DI20240924061000-16379042,DI20240924061000,Cito,"9/24/2024, 4:33:54 AM",2024-09-24 04:33:54,No t equivoquis de ràbia no m en fan gens ! Mes aviat absoluta indiferència ja que per escoltar los haurien de tenir alguna cosa a dir i lo únic que fan es plorar i donar la culpa als altres de tot : res de constructiu tot negatiu i amb gent així la veritat ni cas ,16378167,,
DI20240924061000-16380812,DI20240924061000,Albert,"9/24/2024, 7:06:54 AM",2024-09-24 07:06:54,Jajajajaja,16379042,,
DI20240924061000-16383547,DI20240924061000,Xicago Boy,"9/24/2024, 10:46:31 AM",2024-09-24 10:46:31,"Els preus del lloguer es regulen automàticament segons el mercat. Si els preus del lloguer pugen és perquè hi ha algú disposat a pagar-ne aquell preu i si baixen és perquè a aquell preu més alt el pis no es lloga. Intervenir el mercat i regular-ne el preu només fa que reduir l’oferta i la situació encara empitjora, llavors ja no és que els preus siguin alts, és que directament ja ni s’oferten pisos. Aplica la escasesa de paper de fer caca de Veneçuela als pisos. És el mateix principi.",16380812,,
DI20240924061000-16381250,DI20240924061000,Milton d’Areny-Plandolit,"9/24/2024, 7:42:09 AM",2024-09-24 07:42:09,"Et torno a repetir. Els preus els posa el mercat. Si tu no generes prous ingressos això significa que no ets suficientment productiu i és el teu problema, que has de millorar fen-te més productiu. ",16380812,,
DI20240924061000-16377910,DI20240924061000,Tots treballeu a Andorra,"9/24/2024, 1:56:27 AM",2024-09-24 01:56:27,"Si no fos per Andorra us fotrieu de gana.  Entre setmana La Seu es un poble fantasma, no te vida, algún padri amb bastó passegant.... i para de contar.   Els locals comercials estàn tots en venda, ruina total.",,,
DI20240924061000-16386092,DI20240924061000,Patxoca,"9/24/2024, 2:37:55 PM",2024-09-24 14:37:55,"I el cap de setmana també, però es que andorra no te res, tampoc, comarques. ",16377910,,
DI20240924061000-16377813,DI20240924061000,What,"9/24/2024, 1:40:28 AM",2024-09-24 01:40:28,Aquests discursos populistes amb missatges d'odi no van enlloc. Ara resultarà que altres parts del Pirineu també estan construint andorrans quan els que han vingut a fer-ho a Andorra son espanyols bona part. Tenen el seu propi problema amb inversió del seu propi pais. ,,,
DI20240924061000-16378158,DI20240924061000,Albert,"9/24/2024, 2:32:35 AM",2024-09-24 02:32:35,"Parla del alt Urgell!! Al alt Urgell estar clar que hi ha un problema amb els preus, i part de la culpa la te que baixen andorrans i propietaris i agències immobiliàries volen especular.",16377813,,
DI20240924061000-16378554,DI20240924061000,Xd,"9/24/2024, 3:29:55 AM",2024-09-24 03:29:55,Albert preocupat més per la migració que us ve d'Àfrica que no pas de la d'Andorra... ,16378158,,
DI20240924061000-16386080,DI20240924061000,Calixto,"9/24/2024, 2:35:43 PM",2024-09-24 14:35:43,Sort n’hi ha de les persones migrades que venen! Falta gent per la SS,16378554,,
DI20240924061000-16380836,DI20240924061000,Albert,"9/24/2024, 7:08:50 AM",2024-09-24 07:08:50,Tant andorrans com africans son benvinguts!!,16378554,,
DI20240924061000-16381299,DI20240924061000,Milton d’Areny-Plandolit,"9/24/2024, 7:45:40 AM",2024-09-24 07:45:40,"O sigui… d’una banda et queixes de la manca d’habitatge (assequible) i d’altra banda vols augmentar la demanda important milions d’Africans a Europa? Nano, d’economia no en tens ni idea… si importes immigració massiva, la demanda d’allotjament es dispararà i fins i tot els tuguris més insalubres pujaran el preu del lloguer (llei de la oferta i la demanda)",16380836,,
DI20240924061000-16378444,DI20240924061000,Ralph i Lacoste sempre,"9/24/2024, 3:12:54 AM",2024-09-24 03:12:54,"A l’Alt Urgell i a la Cerdanya no hi ha cap problema amb els preus. Jo vaig heredar del papà una hisenda a Bolvir on hi tenim cavalls i hi pujo amb el Maserati els caps de setmana d’hivern a esquiar, i alguns dies a l’estiu al",16378158,,
DI20240924061000-16380860,DI20240924061000,Albert,"9/24/2024, 7:10:22 AM",2024-09-24 07:10:22,"Ara hu has dit bé, qui ve de fora a fer turisme i els que vivim aquí res ",16378444,,
DI20240924061000-16381463,DI20240924061000,Milton d’areny-plandolit,"9/24/2024, 7:58:29 AM",2024-09-24 07:58:29,Però bé que us agrada quan venen els pijos pixapins de la part alta de Barcelona i deixen els seus diners a la comarca no? Aleshores no us queixeu pas…,16380860,,
DI20240924061000-16380120,DI20240924061000,sven,"9/24/2024, 6:10:32 AM",2024-09-24 06:10:32,JO pujo amb el Lanborghini  es mes economic que el teu  Maserati...,16378444,,
DI20240924061000-16380437,DI20240924061000,Ralph i lacoste sempre,"9/24/2024, 6:38:19 AM",2024-09-24 06:38:19,"Sí, el Lambo està molt bé però ja em diràs on poses els pals de golf! En canvi amb el Quattroporte Trofeo tens l’esportivitat del Lambo i el comfort d’un sedan. Vull dir, el Lambo està molt bé si baixes el dijous al vespre de Sant Cugat a Bling Bling però pel cap de setmana un Quattroporte és molt més còmode i pràctic.",16380120,,
DI20240924061000-16377784,DI20240924061000,Donald,"9/24/2024, 1:34:37 AM",2024-09-24 01:34:37,Construirem un mur a la frontera i el pagaran els de la Seu. Si no tinguessin Andorra al costat encara anirien amb carro,,,
DI20240924061000-16378956,DI20240924061000,jula,"9/24/2024, 4:21:58 AM",2024-09-24 04:21:58,"Andorra no és res, si fem un mur ens morirem de gana nosaltres. tot i que ja aniria bé que es buidés aquest país se sangoneres...",16377784,,
DI20240924061000-16378528,DI20240924061000,Jaume,"9/24/2024, 3:25:50 AM",2024-09-24 03:25:50,Aixó mateix ,16377784,,
DI20240924061000-16378474,DI20240924061000,Cristòfor Colom,"9/24/2024, 3:16:58 AM",2024-09-24 03:16:58,"Cap de cony Andorra a part de videos de youtube no produeix res. Tot ho compreu fora, us fotem un mur i us moriu de gana.",16377784,,
DI20240924061000-16379719,DI20240924061000,Xop,"9/24/2024, 5:37:32 AM",2024-09-24 05:37:32,"El mur te'l fotrien els teus veïns que si interactuen amb Andorra. No et preocupis que ja tirariem per altre costat. Tu no cal que vinguis mai, no ets benvingut. ",16378474,,
DI20240924061000-16386066,DI20240924061000,Mahudl,"9/24/2024, 2:33:46 PM",2024-09-24 14:33:46,Per el pas de la casa a França? Va home!,16379719,,
DI20240924061000-16378135,DI20240924061000,Mossèn andorrà,"9/24/2024, 2:29:13 AM",2024-09-24 02:29:13,Ets més curt que les calces d'un capellà.,16377784,,
DI20240924061000-16377707,DI20240924061000,Anna C,"9/24/2024, 1:24:08 AM",2024-09-24 01:24:08,"Quanta gent de la Seu i de tot l'alt Urgell viu a Andorra ? Moooolta i han estat ben acollits per Andorra i no se'ls ha senyalat mai com un problema per Andorra, ni se'ls culpa de la pujada de preus de l'habitatge a Andorra quan també hi han contribuït. Crec que entre territoris fronterers ens hem de veure com germans, no com enemics. Hem de treballar tots junts per el territori i quan a uns els hi va bé, als altres també els hi va bé. No hem de defensar les rivalitats entre els 2 territoris.",,,
DI20240924061000-16378178,DI20240924061000,Albert,"9/24/2024, 2:36:00 AM",2024-09-24 02:36:00,"Però si es lo que es vol, també teniu un problema de preus a terres andorranes, si tots anem a una potser això canviarà i baixaran els preus",16377707,,
DI20240924061000-16377836,DI20240924061000,suggerència,"9/24/2024, 1:45:24 AM",2024-09-24 01:45:24,"es que encara no han entès per on van els tiros? es tracta de dividir territoris i provocar tensions en un tema que sols afecta a andorra i l'alt urgell, NO  a tot el Pirineu com s'ha publicat, per tant  la noticia la tindrem per dies......mentre els ciutadans es discuteixen i es barallen, aquells que han provocat tot aquest desequilibri  que són els polítics andorrans i els catalans de la generalitat estan cobran a final de mes sense fotre res i sense despentinar-se un pèl ",16377707,,
DI20240924061000-16378069,DI20240924061000,Guineus,"9/24/2024, 2:19:43 AM",2024-09-24 02:19:43,"aquesta plataforma enlloc de dir-se Pirineu Viu, es podria dir Pirineu Espavilat, aquesta setmana passada el partit de Junts(CIU) al congrès dels diputats votava en contra d'una llei per regular el lloguer de pisos de temporada, es obvi si pensem que en aquest partit polític  la majoria són els mateixos rentistes d'aquests pisos i no els interessa baixar els preus a part dels deliris independentistes,  però això no interessa perquè es més fàcil atacar a un pais veí dels propis problemes que solucionar-los  a casa teva",16377836,,
DI20240924061000-16377527,DI20240924061000,ok,"9/24/2024, 12:55:21 AM",2024-09-24 00:55:21,"Si en comptes de legislar en el seu territori per solucionar un problema es dediquen a donar-li la culpa a un altre país, això ja diu molt de lo ineptes que són...res més a dir.",,,
DI20240924061000-16377629,DI20240924061000,"Les coses, clares","9/24/2024, 1:12:58 AM",2024-09-24 01:12:58,Aquesta afirmació es pot girar a la inversa. Els problemes d'habitatge d'Andorra no es poden traslladar a un altre país amb residències fictícies i després culpar-lo.,16377527,,
DI20240924061000-16378000,DI20240924061000,no saben de on cobren,"9/24/2024, 2:08:57 AM",2024-09-24 02:08:57,"be que cobreu els impostos als contructors, les operacions de compra venda, i impostos municipals.... per subvencionar despres a gent sense ofici que es queixa justament de la construcció que els permet vagar tot el dia",16377629,,
DI20240924061000-16377767,DI20240924061000,Ok,"9/24/2024, 1:31:49 AM",2024-09-24 01:31:49,"Exacte, que cada territori s'ocupi de lo seu. Aixi que no toqueu els nasos ",16377629,,
DI20240924061000-16377506,DI20240924061000,Garibaldi,"9/24/2024, 12:51:59 AM",2024-09-24 00:51:59,"El primer que s'ha de fer és aterrar la frontera. A més, culpar algú altre només amaga les pròpies responsabilitats, sobretot les dels polítics catalans. Menys processisme i més interdependentisme. ",,,
DI20240924061000-16377345,DI20240924061000,Problema real,"9/24/2024, 12:32:10 AM",2024-09-24 00:32:10,Si l'habitatge a Andorra fos assequible no es donarien aquestes situacions de residències fictícies.,,,
DI20240924061000-16384831,DI20240924061000,Senyor indignesassequible,"9/24/2024, 12:32:42 PM",2024-09-24 12:32:42,"Tu també ets dels comunistes de DA que vol subvencions i ajuts.     Traduït, regals per ganduls.",16377345,,
DI20240924061000-16378020,DI20240924061000,no son de numeros,"9/24/2024, 2:11:23 AM",2024-09-24 02:11:23,"L'habitatge esta venut casi al 100% per tant es absurd dir que no es assequible, quan esta tot adquirit. Si que es cert que no es assequible per a tothom, que ja es un altre tema diferent, i té mes a veure amb la pobresa que reparteixen els dels cantic i flautes per on manen.",16377345,,
DI20240924061000-16377344,DI20240924061000,fiascu,"9/24/2024, 12:31:47 AM",2024-09-24 00:31:47,"Però qui ha autoritzat les grans superfícies en comptes de protegir el petit comerç de la Seu no ha estat pas Andorra, oi?? Doncs llavors que també mirin cap als seus polítics... i que consti que tenen raó.. tot i que tot aquell que viu a la Seu i treballa a Andorra si vol, té tots els beneficis d'Espanya i quasi tots els d'Andorra.",,,
