comment_id,article_id,comment_author,comment_datetime_displayed,comment_datetime,comment_content,comment_in_answer_to,comment_likes,comment_dislikes
DI20240814060300-15733455,DI20240814060300,Pau sense setembre,"8/14/2024, 4:14:32 AM",2024-08-14 04:14:32,"A l'agost es treballa, i al setembre a la platja panxa al sol, tot pagat per les subvencions...a viure que són dos dies, noi.",15733342,,
DI20240814060300-15732419,DI20240814060300,Tirats con merda dr gos,"8/14/2024, 1:13:52 AM",2024-08-14 01:13:52,Molt nefasta gestio,15731733,,
DI20240814060300-15733093,DI20240814060300,Pau sense vot,"8/14/2024, 3:18:49 AM",2024-08-14 03:18:49,A disfrutar lo que habéis votado...,15732419,,
DI20240814060300-15733346,DI20240814060300,Sisco Llons,"8/14/2024, 3:59:02 AM",2024-08-14 03:59:02,"Exacte, tu ves pagant i mirant.",15733093,,
DI20240814060300-15732391,DI20240814060300,Tirats com burille,"8/14/2024, 1:08:24 AM",2024-08-14 01:08:24,"Deu tenir una sang freda, deixan tirats d aquesta forma a majors que no tenen cap oportunitat gracies a les seves politicas, quina mala sombra i mala gestio ",15731733,,
DI20240814060300-15733129,DI20240814060300,Doncs si,"8/14/2024, 3:25:24 AM",2024-08-14 03:25:24,"Totalment d'acord, ho té el fetge molt gros ho d'esquena molt ample, una de les dues",15732391,,
DI20240814060300-15733349,DI20240814060300,Sisco Llons,"8/14/2024, 3:59:23 AM",2024-08-14 03:59:23,Tota la raó ,15733129,,
DI20240813062400-15722326,DI20240813062400,Tela,"8/13/2024, 1:38:42 AM",2024-08-13 01:38:42,Sumarà 1.500 plets a la Batllia,,,
DI20240813062400-15721757,DI20240813062400,A SI?,"8/12/2024, 11:37:21 PM",2024-08-12 23:37:21,"QUE BÉ, DONCS TOT AQUEST MERDE  HA ESTAT PROVOCAT PER VOSALTRES, I VEIENT COM CREIX EL PAÍS  AMB POBLACIÓ NO SEMBLA QUE VULGUEU ATURAR RESSS ",,,
DI20240812141600-15717922,DI20240812141600,Lluis,"8/12/2024, 1:07:56 PM",2024-08-12 13:07:56,El futur no es a  cap pais de la UE. ,,,
DI20240812141600-15717832,DI20240812141600,Pisos de la.marsol,"8/12/2024, 12:56:54 PM",2024-08-12 12:56:54,Suposo aue entre aquests 1500 pisos estaran el de.la sra marsol i tots els de la familia espot. Xk els meus es vendran o els fare pastera,,,
DI20240812141600-15716893,DI20240812141600,Colorin colorado,"8/12/2024, 11:05:41 AM",2024-08-12 11:05:41,"Tranquis. Dentro de 3 años valdran un 50% mas. Ahi es cuando hay que venddr y transferir el dindro a un 3r pais y dar por finiquitada la etapa en andorra. Hay que llevar el capital donde sean agradecidos ppr contribuir como dubai, montecarlo... andorra ya no es valida",,,
DI20240812141600-15718348,DI20240812141600,Man,"8/12/2024, 1:59:57 PM",2024-08-12 13:59:57,"Colorin, m'imagino que això ho diràs per aqui perque hi ha anonimat, però en persona no ho diguis en segons quins cercles perque es riuran de tu, amb tot el respecte. Els que van a Dubai no van a especular amb el sector immboliari, allà vas quant ja tens una idea per exportar a nivell global, un negoci. Si vas amb la idea de viure allà, només per tindre diners, sortiràs ven esquilat, com les ovelles.",15716893,,
DI20240812141600-15718131,DI20240812141600,Xd,"8/12/2024, 1:34:25 PM",2024-08-12 13:34:25,Bona idea. Good bye als que no saben montar negocis. ,15716893,,
DI20240812141600-15714951,DI20240812141600,Pau sense ànims,"8/12/2024, 8:07:40 AM",2024-08-12 08:07:40,...te animan a ceder el piso a punta de pistola...,,,
DI20240812141600-15714202,DI20240812141600,Andorrà,"8/12/2024, 6:55:36 AM",2024-08-12 06:55:36,"Els números no surten. No apugen els salaris, pugen els lloguers, entra més gent al pais... endureixen acces a certs ajuts i clar donen menys ajuts... caritas i creu roja no donen abast... 1500 en tres anys havent fotut milions d'euros que en 13 no habeu fet res? au va... riurem... ",,,
DI20240812141600-15714170,DI20240812141600,PATÈTIC,"8/12/2024, 6:53:34 AM",2024-08-12 06:53:34,"Tu no estàs construint ressss, es amb els nostres calés que es construeixen i mestrestant  durant els últims 12 anys sols heu provocat aquet problema  ara com a solució expolieu al privat i donareu confeti per vostres aberracions, I VOL SORTIR AQUI COM SI FOS LA JUANA DE HARCO DEL PRINCIPAT QUE DONA LA VIDA PER EL POBLE, QUE GALTES QUE ES TOTA AQUESTA GENT ",,,
DI20240812141600-15721160,DI20240812141600,xavi,"8/12/2024, 9:28:59 PM",2024-08-12 21:28:59,"El problema es, que els politics no están preparats per res, tocan temes i no tenen idea.",15714170,,
DI20240809054200-15691752,DI20240809054200,jtv,"8/9/2024, 12:56:34 PM",2024-08-09 12:56:34,Un referendum no vinculant es inacceptable per a una decisio d'aquesta magnitut,,,
DI20240809054200-15692232,DI20240809054200,.,"8/9/2024, 2:04:43 PM",2024-08-09 14:04:43,Lo innaceptable serà si tots els consellers no voten el resultat del referendum. ,15691752,,
DI20240809054200-15691443,DI20240809054200,Puchi,"8/9/2024, 12:19:03 PM",2024-08-09 12:19:03,"Hi han comentaris penosos! A casa Meva....a casa Meva......jo US diré a a casa Meva tots son majors d edat per escollir segons el seu criteri, i lo Mateix a casa d aquests que s omplen la boca de a casa Meva.....penos, vergonyos.....sembleu al puigdemont....yo mando y ordeno. ..cada un votara segons lo que pensi.......si es si doncs si......si es no .....doncs .....no.....pero ningu ordena a ningun lo que ha de votar. .......año 2024",,,
DI20240809054200-15691708,DI20240809054200,Xd,"8/9/2024, 12:50:03 PM",2024-08-09 12:50:03,No cal que et posis nerviós pel possible resultat. Quan alguns diuen en casa meva votaran això... no és perque sigui una directriu. En la majoria de families es parla i normalment s'arriba a un mateix punt. Jo no dic que han de votar i tots pensem igual... Menys paranoies estaria bé.. ,15691443,,
DI20240809054200-15691314,DI20240809054200,Vots,"8/9/2024, 12:03:23 PM",2024-08-09 12:03:23,A casa son 6 NO  a EUROPA NO a DA,,,
DI20240809054200-15690425,DI20240809054200,Un que es Francès,"8/9/2024, 10:05:42 AM",2024-08-09 10:05:42,Si el referèndum no es vinculant millor que tots marxem a un altre lloc ja que jo he tingut que marxa de França per culpa de estar a Europa .,,,
DI20240809054200-15691265,DI20240809054200,Un autre français !,"8/9/2024, 11:55:35 AM",2024-08-09 11:55:35,Totalement d'accord avec vous. Ils ne se rendent pas compte qu'ils sont entrain de détruire un paradis ! Ce sont des abrutis inconscients ! ,15690425,,
DI20240809054200-15688952,DI20240809054200,J Reig,"8/9/2024, 6:54:54 AM",2024-08-09 06:54:54,Seria just que després de vendre's el país a Europa la gent pugui votar.,,,
DI20240809054200-15687897,DI20240809054200,LO NOSTRE VA A MISSA,"8/9/2024, 4:53:01 AM",2024-08-09 04:53:01,"Qui sou vosaltres els polítics per decidir un SI  com una casa surti lo que surt? El futur del país el decideix la gent del país no un govern pagat per tots nosaltres, Ni som cubà, Ni som Nort Coreà, la paraula del poble es la que compta i no lo que digueu vosaltres, a vosaltres us posem i us treurem nosaltres ",,,
DI20240809054200-15691138,DI20240809054200,Simpatitzant de la CNT,"8/9/2024, 11:40:41 AM",2024-08-09 11:40:41,Només vull l'opció de votar perquè els cacics perdeu poder. Despés sortirà el que surti.,15687897,,
DI20240809054200-15687613,DI20240809054200,Joannic,"8/9/2024, 3:59:55 AM",2024-08-09 03:59:55,"Un govern que posa un referèndum NO VINCULANT ha de ser illegalitzat per anti democràtic. Comencem a exigir que, Si ES VERITAT QUE ESTEM EN DEMOCRÀCIA, el poder de decisió ha de ser del poble. ",,,
DI20240809054200-15688202,DI20240809054200,Pep,"8/9/2024, 5:27:00 AM",2024-08-09 05:27:00,Et patina l’embrague noi !!!,15687613,,
DI20240809054200-15688935,DI20240809054200,Tu que ets DA?,"8/9/2024, 6:53:07 AM",2024-08-09 06:53:07,"Poder al qui li patina el embrague es A tu, aquí va del nostre futur i el nostre país i això ho decideix tot un poble,  no el cap de govern ho perico de los palotes a menys que estiguem amb DICTADURA, en tot cas que ens aclarin si som un pais amb democràcia ho s'ha establert ja la dictadura que moltes vegades ja estem amb dubte amb tanta censura hi històries ",15688202,,
DI20240809054200-15687944,DI20240809054200,RAGNAR,"8/9/2024, 5:00:18 AM",2024-08-09 05:00:18,+1 👌,15687613,,
DI20240809054200-15687451,DI20240809054200,Moneda dues cares,"8/9/2024, 3:29:51 AM",2024-08-09 03:29:51,"Cal recordar que Espot, Marsol i la premsa juguen a la mateixa lliga, no us deixeu enganyar.",,,
DI20240809054200-15687898,DI20240809054200,Miquel,"8/9/2024, 4:53:18 AM",2024-08-09 04:53:18,"Se li diu, bomba sonda, totalment d’acord amb tu.",15687451,,
DI20240809054200-15687369,DI20240809054200,Global,"8/9/2024, 3:12:17 AM",2024-08-09 03:12:17,"Aquesta ministra és una vergonya ! I aquest govern, ni parlar-ne ! De SI he passat a NO perquè veien com funciona la política andorrana de manera tant infantil, no puc tenir confiança. Potser m’equivoco però dubto que aquest acord doni resultats positius. Ens ho pinten molt bonic i això fa pudor. ",,,
DI20240809054200-15687571,DI20240809054200,TOO MUCH,"8/9/2024, 3:52:14 AM",2024-08-09 03:52:14,"Bueno ja es un bon fart de riure el fet de veure una ministra portant 3 o 4 carteres això no és veu ni a GILILANDIA, això sí ni una portada amb cara i ulls",15687369,,
DI20240809054200-15687334,DI20240809054200,COCOCALVIN,"8/9/2024, 3:04:41 AM",2024-08-09 03:04:41,NI ELLS MATEIXOS SABEN COM ANIRÀ TOT PLEGAT. VERGONYÒS.,,,
DI20240809054200-15687595,DI20240809054200,Carles,"8/9/2024, 3:56:23 AM",2024-08-09 03:56:23,Però penseu que surtira el no.,15687334,,
DI20240809054200-15687583,DI20240809054200,Si no escolten,"8/9/2024, 3:54:35 AM",2024-08-09 03:54:35,"I de que serveix votar si ho no si surti el que surti ens i foten de CAP, a menys que tot 3l poble es tiri al carrer com a BANGLADHES aquets no escolten",15687334,,
DI20240809054200-15687059,DI20240809054200,Allsop,"8/9/2024, 2:03:04 AM",2024-08-09 02:03:04,Tot això sembla un pati d’escola 🤦‍♂️,,,
DI20240809054200-15686979,DI20240809054200,Sense trampes,"8/9/2024, 1:40:33 AM",2024-08-09 01:40:33,Lo important és que el recompte de vots del referèndum sigui legítim,,,
DI20240809054200-15686922,DI20240809054200,Maria.,"8/9/2024, 1:23:39 AM",2024-08-09 01:23:39,Tot plegat una vergonya.,,,
DI20240809054200-15686886,DI20240809054200,Floreta,"8/9/2024, 1:15:12 AM",2024-08-09 01:15:12,La ministra Marsol té raó,,,
DI20240809054200-15686857,DI20240809054200,Ex-votants de DA,"8/9/2024, 1:06:21 AM",2024-08-09 01:06:21,"Que les convoquin quan vulguin, a casa ho tenim claríssim i no canviarem . NO a l'acord i NO a DA",,,
DI20240809054200-15687919,DI20240809054200,Miquel,"8/9/2024, 4:56:04 AM",2024-08-09 04:56:04,Claríssim,15686857,,
DI20240809054200-15687681,DI20240809054200,Cal perfums,"8/9/2024, 4:12:43 AM",2024-08-09 04:12:43,A casa nostra també no EU no DA!,15686857,,
DI20240809054200-15687035,DI20240809054200,Allsop,"8/9/2024, 1:57:23 AM",2024-08-09 01:57:23,A casa meva igual ! ,15686857,,
DI20240809054200-15686784,DI20240809054200,Pep,"8/9/2024, 12:43:40 AM",2024-08-09 00:43:40,"Com tot en aquest Govern ara si, ara no. ara giro a dreta i despres a l'esquerra. Anar virant sense rumb",,,
DI20240809054200-15686744,DI20240809054200,malson,"8/9/2024, 12:33:05 AM",2024-08-09 00:33:05,"Patètic veure com el propi Govern es desautoritza. Quina confiança ens poden donar? S'evidencia la descomposició de DA, comencen a volar els ganivets. Ara ja no es donen tants premis entre ells.",,,
DI20240809054200-15686808,DI20240809054200,Marson,"8/9/2024, 12:53:19 AM",2024-08-09 00:53:19,Si esta pactat,15686744,,
DI20240809054200-15686726,DI20240809054200,No,"8/9/2024, 12:28:36 AM",2024-08-09 00:28:36,"La que ens ha deixat sense cap futur ni feine ni cass al mayors de 45 anys, jo no la vull",,,
DI20240809054200-15686896,DI20240809054200,VERGONYOS,"8/9/2024, 1:17:20 AM",2024-08-09 01:17:20,"Totalment ‘acord amb tu, aquesta seria la ultima ni perden la vida, als majors de 45 anys ens a deixat tirats a tots a la cuneta, sense feina, sense cass i cancel·lant tots els programes d'ocupació per els majors de 45 anys ( lo mai vist a cap país del mon) trinxar al col·lectiu mes vulnerable ( nefasta gestora, ni amb pintura)  ",15686726,,
DI20240809054200-15687719,DI20240809054200,Mery,"8/9/2024, 4:20:50 AM",2024-08-09 04:20:50,"Amb que no compti, som 4 d aqui, sempre ajudant a la gent d fora i nos que estem tirats amb mes de 50 anys ni programes, ni cass ni empatia, No conteu no",15686896,,
DI20240809054200-15686718,DI20240809054200,haters perquè si,"8/9/2024, 12:27:39 AM",2024-08-09 00:27:39,Gent en contra de l'acord d'associació sense llegir una paguina del text en 3...2...1,,,
DI20240809054200-15687047,DI20240809054200,Allsop,"8/9/2024, 2:00:23 AM",2024-08-09 02:00:23,"Si tants espanyols venen a viure aquí, per alguna cosa serà ! 🤷‍♂️",15686718,,
DI20240809054200-15686993,DI20240809054200,Jordi,"8/9/2024, 1:44:51 AM",2024-08-09 01:44:51,"Si et convenç l’actual model europeu, perquè no te n’hi vas a viure? Als d’aqui ens agrada l ‘Andorra sobirana, no la submissió a les regles d’un model que s’esfonsa",15686718,,
DI20240809054200-15686952,DI20240809054200,Josep,"8/9/2024, 1:30:08 AM",2024-08-09 01:30:08,"Ela polítics ens volen fer creure que la merda és bona, però a mi no em cal provar-la per saber-ho.",15686718,,
DI20240809054200-15686919,DI20240809054200,La foto ja parla,"8/9/2024, 1:22:56 AM",2024-08-09 01:22:56,LA UE ES DESINTEGRA ,15686718,,
DI20240809054200-15686866,DI20240809054200,jo,"8/9/2024, 1:08:14 AM",2024-08-09 01:08:14,Home a vostè no el veig per moltes lectures. Poques PAGUINES ha llegit,15686718,,
DI20240809054200-15686819,DI20240809054200,Vigila el que llegeixes,"8/9/2024, 12:57:14 AM",2024-08-09 00:57:14,"Els oficialistes us aferreu a l'esbiaixada creença que la majoria de la població és ignorant excepte vosaltres, i que teniu la veritat absoluta.",15686718,,
DI20240809054200-15686686,DI20240809054200,No ens representeu,"8/9/2024, 12:14:05 AM",2024-08-09 00:14:05,"Estratègies de l'Status Quo ja que en política res no passa per casualitat, a més, sempre en benefici de la classe política i els seus còmplices.",,,
DI20240809054200-15686614,DI20240809054200,Josep,"8/8/2024, 11:46:20 PM",2024-08-08 23:46:20,Doncs un o altre ha de presentar la dimissió. ,,,
DI20240809054200-15686498,DI20240809054200,hi haurà referèndum?,"8/8/2024, 10:58:29 PM",2024-08-08 22:58:29,Això si és que hi ha referèndum... que a aquest pas no ho veig tan clar.... 😅,,,
DI20240809054200-15686997,DI20240809054200,Jordi,"8/9/2024, 1:46:09 AM",2024-08-09 01:46:09,La questió es que no falsegin els resultats,15686498,,
DI20240809054200-15686436,DI20240809054200,Ciutadà.,"8/8/2024, 10:34:10 PM",2024-08-08 22:34:10,Espero que Marsol no arribi mai a cap de govern: persona de molt soroll i poques nous en gairebé tot.,,,
DI20240809054200-15686625,DI20240809054200,Misco Jones,"8/8/2024, 11:51:50 PM",2024-08-08 23:51:50,"Déu vos escolti, sinó tindrem merdafonts a preu d'or, circ de la lluna del ""todo a 100"", FestiFlors perquè les onlyfansers es blanquegin al instagram i demés marsolades a cada parròquia.",15686436,,
DI20240809054200-15686311,DI20240809054200,Kamala Marsol.,"8/8/2024, 9:38:14 PM",2024-08-08 21:38:14,La Marsol a vegades te seny….,,,
DI20240809054200-15686303,DI20240809054200,una mica de seny,"8/8/2024, 9:34:14 PM",2024-08-08 21:34:14,"Despres NO, abans del referèndum.",,,
DI20240808181000-15684294,DI20240808181000,Lolita,"8/8/2024, 2:31:49 PM",2024-08-08 14:31:49,"Molt be!!! tots coordinats, sort que son tots de DA jajaja, que ràpid despatxaran a la Marsol,  i el Torres sempre ben a prop de l'Espot..a la seva dreta,  qui es presentarà encapçalant la llista a les prperes generals? ",,,
DI20240808181000-15684084,DI20240808181000,Fassbinder,"8/8/2024, 2:06:46 PM",2024-08-08 14:06:46,Politics ineptes per tot arreu!,,,
DI20240808181000-15682218,DI20240808181000,Jo mateixa o dic NOOOO,"8/8/2024, 10:46:11 AM",2024-08-08 10:46:11,"MIEDO, TENGO MIEDO.... po té que sap que sortira que no. O si esta tan segur de lo signat amb la C.E que pregunti ja, que ens sembla. MIEDO. TENGO MIEDO....",,,
DI20240808181000-15682175,DI20240808181000,Tix,"8/8/2024, 10:41:58 AM",2024-08-08 10:41:58,Sr Espot,,,
DI20240808181000-15681851,DI20240808181000,A dormir ja,"8/8/2024, 10:10:23 AM",2024-08-08 10:10:23,No us volem 3 anys mes a govern. No serviu. Us va gran...,,,
DI20240808181000-15681658,DI20240808181000,Joan,"8/8/2024, 9:44:48 AM",2024-08-08 09:44:48,"No es prematur, es necessari que marxis. ",,,
DI20240808181000-15681010,DI20240808181000,Esclop,"8/8/2024, 8:35:24 AM",2024-08-08 08:35:24,"Això solament és el principi, Espot. Cada dia que passa tens menys força. Començaran a demanar la teva dimissió els teus propis ministres.",,,
DI20240808181000-15680951,DI20240808181000,Josep,"8/8/2024, 8:30:20 AM",2024-08-08 08:30:20,Doncs aquí algú ha de presentar la dimissió...,,,
DI20240808133100-15684807,DI20240808133100,Fora,"8/8/2024, 3:54:10 PM",2024-08-08 15:54:10,"Sra. Marisol fora, com a Consul i com a ministra hem vist el résultat.",,,
DI20240808133100-15681018,DI20240808133100,Esclop,"8/8/2024, 8:36:32 AM",2024-08-08 08:36:32,Per una vegada... bravo Conxita! Espot dimissió!,,,
DI20240808133100-15683514,DI20240808133100,I.lussions,"8/8/2024, 1:14:41 PM",2024-08-08 13:14:41,"No siguis il.lús...ja s'ho  tenien pactat de bon principi...ella ser la successora, i en té moltes ganes...pobres de nos!!!",15681018,,
DI20240808133100-15680876,DI20240808133100,Pere,"8/8/2024, 8:21:59 AM",2024-08-08 08:21:59,No espereu!!!! feu-les demà!  hi ha molta feina a fer i no fan falta mes desastres,,,
DI20240808133100-15680741,DI20240808133100,Josep,"8/8/2024, 8:09:09 AM",2024-08-08 08:09:09,"Si el pati està tan calent, primer convoqueu eleccions, i després el referèndum VINCULANT sense trampes ni caixes de cartró que valguin.",,,
DI20240808133100-15680444,DI20240808133100,Fashion slave,"8/8/2024, 7:41:49 AM",2024-08-08 07:41:49,Millor abans ,,,
DI20240808133100-15680327,DI20240808133100,Conchita Sanchez Macron,"8/8/2024, 7:29:23 AM",2024-08-08 07:29:23,Toma puñalada trapera al presi xaval!!! Jajajaja Aquesta ja es veu al trono de hierro.,,,
DI20240808133100-15680228,DI20240808133100,PARLEMCOMCAL,"8/8/2024, 7:18:48 AM",2024-08-08 07:18:48,TU DEMANAs que ja veuras com aneu  al carrer la UE i DA.....,,,
DI20240808133100-15680008,DI20240808133100,Pirates,"8/8/2024, 6:58:23 AM",2024-08-08 06:58:23,"I tant que s'hauran de fer eleccions. I m'atreveixo a dir que la participació serà el doble que a la del referèndum. No cal que digui el perquè, oi?",,,
DI20240808133100-15679916,DI20240808133100,Jose Luis,"8/8/2024, 6:48:41 AM",2024-08-08 06:48:41,Alucino! Una ministra própia del Govern actual que ja vol fer fòra al Cap????? Tens l’enemic a casa Xavi! Veure per creure……,,,
DI20240808133100-15679547,DI20240808133100,Fassbinder,"8/8/2024, 6:12:48 AM",2024-08-08 06:12:48,I perque no ara mateix?,,,
DI20240808133100-15679205,DI20240808133100,Algo de seny….,"8/8/2024, 5:42:50 AM",2024-08-08 05:42:50,"Que no serveixi de precedent, per un cop estic d accord amb la Sra Marsol. ",,,
DI20240808133100-15683537,DI20240808133100,Quanta ambició!,"8/8/2024, 1:17:13 PM",2024-08-08 13:17:13,No  rasqueu bola!,15679205,,
DI20240808133100-15678966,DI20240808133100,Adéu,"8/8/2024, 5:21:38 AM",2024-08-08 05:21:38,Increïble que això ho digui una ministra en funcions. En qualsevol altre país se'n va al carrer. DA s'enfonsa.,,,
DI20240808133100-15678885,DI20240808133100,Doncs Concòrdia,"8/8/2024, 5:12:49 AM",2024-08-08 05:12:49,"Fantàstic, ja tardeu. Estem amb vosaltres Escalé.",,,
DI20240808133100-15683553,DI20240808133100,"Más de lo mismo,","8/8/2024, 1:18:47 PM",2024-08-08 13:18:47,Com se os veu el plumero!!!,15678885,,
DI20240808133100-15680626,DI20240808133100,Carles,"8/8/2024, 7:58:39 AM",2024-08-08 07:58:39,+1 cap a l’E i Concòrdia,15678885,,
DI20240808133100-15679469,DI20240808133100,Escalo,"8/8/2024, 6:05:57 AM",2024-08-08 06:05:57,Escale no sap ni per on començar,15678885,,
DI20240808133100-15683557,DI20240808133100,"Más de lo mismo,","8/8/2024, 1:19:31 PM",2024-08-08 13:19:31,Exacte ..ell escalando....el caminet llaurat. ,15679469,,
DI20240808133100-15679970,DI20240808133100,Andorra,"8/8/2024, 6:54:42 AM",2024-08-08 06:54:42,Totalment d'acord. Jo el meu vot al PS,15679469,,
DI20240808133100-15680231,DI20240808133100,PARLEMCOMCAL,"8/8/2024, 7:19:25 AM",2024-08-08 07:19:25,EL PS  no saps no com acabar amb el passat  fora...,15679970,,
DI20240808133100-15678813,DI20240808133100,Farts de vosaltres,"8/8/2024, 5:05:07 AM",2024-08-08 05:05:07,"Estarà conten el poble, al que heu EMPOBRIT i TRINXAT si foteu el camp de una punyetera vegada",,,
DI20240808133100-15678745,DI20240808133100,jajaja,"8/8/2024, 4:59:16 AM",2024-08-08 04:59:16,"i tu et presentara de Capa de Govern, jajajajajajajaja",,,
DI20240808133100-15678728,DI20240808133100,Desesperada,"8/8/2024, 4:57:13 AM",2024-08-08 04:57:13,Aquesta està desesperada per agafar la cadira. Només espero que per una sola vegada els andorrans tinguin memòria de les polítiques nefastes de DA i els seus esbirros quan arribi el moment de tornar a votar.,,,
DI20240808133100-15678670,DI20240808133100,Anti globalista,"8/8/2024, 4:51:31 AM",2024-08-08 04:51:31,Al referèndum votarem que no a la UE després a les eleccions votarem per fer fora el govern que ha volgut vendre‘s el país al globalisme. ,,,
DI20240808133100-15689333,DI20240808133100,TRADICIONAL,"8/9/2024, 7:39:23 AM",2024-08-09 07:39:23,"TOTALMENT D ACORD, LO QUE FAN ELS CALÉS",15678670,,
DI20240808133100-15678667,DI20240808133100,Vergonyós,"8/8/2024, 4:50:49 AM",2024-08-08 04:50:49,Perquè doneu la opció als comentaris si solament accepteu  els del règim? Fa fàstic la vostre censura,,,
DI20240808133100-15680637,DI20240808133100,Josep,"8/8/2024, 7:59:17 AM",2024-08-08 07:59:17,"Doncs a mi amb els nicks de Pere, El Dissident Incòmode,  Les Dues Andorra, El Club,  i ara aquest últim (Josep), molt i molt pocs he tingut censurats. ",15678667,,
DI20240808133100-15678780,DI20240808133100,Josep,"8/8/2024, 5:02:05 AM",2024-08-08 05:02:05,"Discrepo. Personalment sempre em publiquen els missatges amb tots els nicks que tinc, i t'asseguro que no són favorables al règim. ",15678667,,
DI20240808133100-15678888,DI20240808133100,Tot censurat,"8/8/2024, 5:12:55 AM",2024-08-08 05:12:55,"Deus ser el nen MACO de la casa, vinga va! Si la censura de aquest diari es un escandalo",15678780,,
DI20240808133100-15680335,DI20240808133100,Emma,"8/8/2024, 7:30:27 AM",2024-08-08 07:30:27,"Totalment d'acord,  jo he estat censurada mes d'un cop.",15678888,,
DI20240808133100-15680276,DI20240808133100,No tot censurat,"8/8/2024, 7:23:23 AM",2024-08-08 07:23:23,Tampoc em solen censurar gairebe res a mi i no soc amic de ningu tampoc.,15678888,,
DI20240808133100-15678647,DI20240808133100,KIM IL SUNG,"8/8/2024, 4:47:33 AM",2024-08-08 04:47:33,"No us enganyeu, això és un intent a la desesperada per a què votem que SÍ. El que es deixi enganyar és ruc!!",,,
DI20240808133100-15678559,DI20240808133100,Josep,"8/8/2024, 4:36:33 AM",2024-08-08 04:36:33,"Mentre el referèndum no sigui vinculant, l'abstenció hauria de comptar con un NO.",,,
DI20240808133100-15680352,DI20240808133100,A votar osti,"8/8/2024, 7:32:22 AM",2024-08-08 07:32:22,Abstencio es abstencio... mogueu el punyetero cul i a votar que no. Que despres tot son queixes...,15678559,,
DI20240808133100-15679039,DI20240808133100,Ves a Votar !!!,"8/8/2024, 5:28:29 AM",2024-08-08 05:28:29,"Si no vas a votar, l abstenció, es el que vota la majoria.",15678559,,
DI20240808133100-15678558,DI20240808133100,Per mi JA,"8/8/2024, 4:35:59 AM",2024-08-08 04:35:59,"Si es per foter-la a fora a ella per mi ara mateix, i espero que sigui així, artifice de la destrucció de la classe treballadora i del futur dels nostres fill, saturats de Ella i DA",,,
DI20240808133100-15678544,DI20240808133100,John Wayne,"8/8/2024, 4:32:59 AM",2024-08-08 04:32:59,"o sigui que donen per fet que sortirà el si tot i que tothom hi està en contra ia més encara no s'ha votat o bé pensen que si en surt no, no és vinculant i faran el que els doni la gana perquè a ells andorra se'ls queda petit i els ha agradat això de caminar de foto a foto per la UE. vanitat.",,,
DI20240808133100-15678500,DI20240808133100,CONCÒRDIA 2025 - 2050,"8/8/2024, 4:27:05 AM",2024-08-08 04:27:05,No hem de perdre aquesta oportunitat per fer fora al govern que ha deixat a les famílies del país ofegades econòmicament i sense pisos on viure.,,,
DI20240808133100-15689368,DI20240808133100,TRADICIONAL,"8/9/2024, 7:43:51 AM",2024-08-09 07:43:51,JO A LA PROPERA CONCÒRDIA,15678500,,
DI20240807055100-15678567,DI20240807055100,M. J. A,"8/8/2024, 4:36:56 AM",2024-08-08 04:36:56,Se es verdad tienen toda la razón. Andorra tiene tres soluciones: o sube los sueldos en qualidade o que bajen los precios d'habitage o no aceptar a nadie más e punto. Yo llevo 37 años al País e no tengo que ir a dormir e comer al País vecino.,,,
DI20240807055100-15668604,DI20240807055100,CANSINO,"8/7/2024, 1:27:14 AM",2024-08-07 01:27:14,Un article del Calsina que menciona Sant Julia??? Que estrany!,,,
DI20240807055100-15668481,DI20240807055100,Joan,"8/7/2024, 1:03:56 AM",2024-08-07 01:03:56,Bon i necessari article Sr Calsina,,,
DI20240807055100-15667587,DI20240807055100,Germans,"8/6/2024, 9:18:00 PM",2024-08-06 21:18:00,"Soc de La Seu i hi visc, i et puc assegurar que els que som d’aqui o porten uns anys, no compartim en absolut la opinio d’aquesta publicacio vers Andorra i els Andorrans. ",,,
