ara-2024-09-24 09:45:22-Espot posa en relleu els avenços d'Andorra en digitalització a la Cimera del futur de l'ONU,2024-09-25 23:35:45.417289,ara,andorra,2024-09-24 09:45:22,politica,article,Espot posa en relleu els avenços d'Andorra en digitalització a la Cimera del futur de l'ONU,https://www.ara.ad/politica/espot-posa-relleu-avencos-d-andorra-digitalitzacio-cimera-futur-l-onu_1_5149759.html,"Xavier Espot, cap de Govern d'Andorra, ha participat en la Cimera del Futur, dins de la 79a Assemblea General de les Nacions Unides a Nova York","Andorra la VellaXavier Espot, cap de Govern, ha centrat el seu discurs en els efectes socials de la revolució digital durant una taula rodona prèvia a la sessió plenària de la Cimera del Futur, que se celebra en el marc de la setanta-novena Assemblea General de les Nacions Unides a Nova York. Espot ha ressaltat la necessitat de fixar principis compartits que garanteixin un espai digital accessible i equitatiu per a tothom. En aquest sentit, ha destacat que Andorra és un dels territoris millor comunicats del món, amb un 96% de la població que té accés a internet. ""La cooperació és essencial per aconseguir un espai digital comú"", ha afirmat Espot.  Durant la seva intervenció, el cap de Govern ha subratllat com la digitalització ha modificat l'estil de vida de la societat, advertint que aquestes modificacions comporten riscos i necessiten adaptació. Ha afirmat que la revolució digital actual és tan ràpida que pot durar cent anys, a diferència d'altres canvis que han perdurat milers d'anys. Espot ha mencionat també que la pandèmia de la Covid-19 va evidenciar una gran divisió en l'accés a les tecnologies, deixant clar que la digitalització ""no ha estat universal"". Per combatre aquestes desigualtats, ha considerat imprescindible establir principis que garanteixin un espai digital comú accessible per a tothom.  A més, el cap de Govern ha destacat que, malgrat ser un país petit, Andorra es troba en una posició privilegiada pel que fa a la comunicació digital. Ha mencionat que la transició digital és crucial per assolir els Objectius de Desenvolupament Sostenible (ODS), la qual pot impulsar el creixement econòmic, promoure el treball digne i millorar àmbits com l'educació i la igualtat de gènere. Finalment, Xavier Espot té previst intervenir aquesta nit en la sessió plenària de la Cimera del Futur, on continuarà defensant la importància d'un futur digital inclusiu i equitatiu per a tots.",,,,,,,,
ara-2024-09-24 11:07:20-Traslladats a l'Hospital dos ferits per un accident de trànsit a la Bartra,2024-09-25 23:35:45.417289,ara,andorra,2024-09-24 11:07:20,successos,article,Traslladats a l'Hospital dos ferits per un accident de trànsit a la Bartra,https://www.ara.ad/successos/traslladats-l-hospital-ferits-accident-transit-bartra_1_5149788.html,L'accident ha estat a les 6:30 del matí,"Andorra la VellaUn accident de trànsit ha tingut lloc aquest matí a la zona de la Bartra, a la carretera General 2, deixant dues persones ferides. Segons han informat els bombers, han rebut l’avís a les 6.40 hores i un dels ferits ha estat traslladat a l’Hospital Nostra Senyora de Meritxell. L’accident, que ha implicat un sol vehicle, s’ha produït a les 6.30 del matí i ha obligat a tallar el carril de pujada, on ha quedat aturat el cotxe. Els serveis d’emergència han habilitat un pas alternatiu per garantir la circulació mentre es duia a terme la seva intervenció.",,,,,,,,
ara-2024-09-24 11:57:43-Divuit anys de presó per abusar de tres menors a l'Alt Urgell,2024-09-25 23:35:45.417289,ara,andorra,2024-09-24 11:57:43,successos,article,Divuit anys de presó per abusar de tres menors a l'Alt Urgell,https://www.ara.ad/successos/divuit-anys-preso-abusar-tres-menors-l-alt-urgell_1_5149814.html,"Les víctimes van explicar, en el judici celebrat el 24 de gener passat, que l'home els feia tocaments quan les portava amb cotxe a l'institut o a una caseta que tenia","Andorra la VellaL'Audiència de Lleida ha condemnat a 18 anys de presó a un home per abusar sexualment de tres noies menors d'edat al terme municipal de Coll de Nargó (Alt Urgell) l'any 2020, segons ha avançat Catalunya Ràdio i ha confirmat el Tribunal Superior de Justícia de Catalunya. L'Audiència dona credibilitat a les declaracions de les joves, una de les quals és filla de l'exparella del processat i les altres dues estaven en règim d'acollida. Segons RadioSeu, les víctimes van explicar, en el judici celebrat el 24 de gener passat, que l'home els feia tocaments quan les portava amb cotxe a l'institut o a una caseta que tenia a la muntanya. A més, una d'elles va dir que li va arribar a introduir els dits a la vagina. Per la seva part, l'acusat va negar els fets.  La jutgessa exposa en la seva sentència que les declaracions de les tres víctimes van ser ""plenament coherents, amb una narració lògica i coincident entre si i sense contradiccions"". A més, es veu ratificada pels psicòlegs de l'Equip d'Assessorament Tècnic en l'Àmbit de Família (EATAF), que donen plena credibilitat als seus relats, sobretot per la ""simptomatologia"" que presenten arran dels fets. En concret, l'Audiència condemna l'home per tres delictes d'abús sexual continuat, un dels quals amb accés carnal, i amb l'agreujant de superioritat. A més, li imposa 5 anys de llibertat vigilada després de complir la condemna i que indemnitzi les víctimes amb 15.000, 5.000 i 4.000 euros respectivament. També determina mesures perquè no pugui acostar-se a les denunciants o treballar amb menors d'edat.",,,,,,,,
ara-2024-09-24 19:28:07-Europa recomana establir la prohibició de fumar a les terrasses,2024-09-25 23:35:45.417289,ara,andorra,2024-09-24 19:28:07,societat,article,Europa recomana establir la prohibició de fumar a les terrasses,https://www.ara.ad/societat/europa-recomana-establir-prohibicio-fumar-terrasses_1_5150096.html,Brussel·les continua amb la lluita contra el tabaquisme,"Andorra la VellaLa Comissió Europea ha presentat aquest dimarts una recomanació per a ampliar les zones lliures de fum a parcs infantils, piscines, parades d'autobús, estacions o espais a l'aire lliure de col·legis i hospitals, tal com informen diferents mitjans espanyols. I per primera vegada Brussel·les demana que s'apliqui als 'vapeadors' o cigarrets electrònics. Però la recomanació no és vinculant, ja que Europa no compta amb competències de Sanitat, per la qual cosa dependrà dels països aplicar-la o no.  La proposta, destinada a fer front als riscos que plantegen els aerosols i el tabac, amplia l'àmbit d'aplicació de les normes anteriors, vigents des de 2009, i introdueix la prohibició de fumar en els espais a l'aire lliure, inclosos els productes innovadors que no contenen nicotina.",,,,,,,,
ara-2024-09-24 21:20:41-Hospitalitzats dos homes després de barallar-se a Sant Julià,2024-09-25 23:35:45.417289,ara,andorra,2024-09-24 21:20:41,successos,article,Hospitalitzats dos homes després de barallar-se a Sant Julià,https://www.ara.ad/successos/hospitalitzats-homes-despres-barallar-sant-julia_1_5150307.html,La disputa va tenir lloc a Sant Julià de Lòria,"Sant Julià de LòriaLa Policia va detenir, diumenge a la nit a Sant Julià de Lòria, dos homes de 43 i 45 anys com a presumptes autors de delictes contra la integritat física i moral. Segons expliquen des del cos d'ordre, tots dos van agredir-se mútuament durant una baralla als carrers. Es trobaven sota els efectes de l'alcohol i van haver de ser traslladats a l'hospital per ser atesos de les diverses lesions que presentaven.",,,,,,,,
ara-2024-09-24 17:18:17-La línia de bus dels Serradells torna a tenir parada davant del comú,2024-09-25 23:35:45.417289,ara,andorra,2024-09-24 17:18:17,societat,article,La línia de bus dels Serradells torna a tenir parada davant del comú,https://www.ara.ad/societat/linia-bus-dels-serradells-torna-parada-davant-comu_1_5149976.html,Cal recordar que aquest servei inicia el recorregut a les set del matí i el finalitza a les 21.30 de dilluns a divendres,"Andorra la VellaLa línia de bus comunal dels Serradels (LS) recupera aquest dimecres el recorregut habitual després que s’hagin finalitzat les obres de remodelació del viaducte de Doctor Vilanova. D’aquesta manera, el servei de transport de passatgers, que arriba fins a la Comella Parc, tornarà a fer parada davant del comú d’Andorra la Vella i baixarà pel mateix viaducte direcció a la parada situada davant del Bici Lab Andorra, segons informen des de la corporació comunal. Cal recordar que aquest servei inicia el recorregut a les set del matí i el finalitza a les 21.30 de dilluns a divendres, amb una freqüència de trenta minuts. Els caps de setmana i festius, el servei arrenca a les 7.30 hores i la freqüència de pas és d'una hora.",,,,,,,,
ara-2024-09-24 13:03:45-Concòrdia presenta les esmenes a la llei òmnibus amb l'objectiu d'incentivar la sostenibilitat demogràfica,2024-09-25 23:35:45.417289,ara,andorra,2024-09-24 13:03:45,politica,article,Concòrdia presenta les esmenes a la llei òmnibus amb l'objectiu d'incentivar la sostenibilitat demogràfica,https://www.ara.ad/politica/concordia-presenta-esmenes-llei-omnibus-l-objectiu-d-incentivar-sostenibilitat-demografica_1_5149844.html,"Pol Bartolomé, conseller de Concòrdia, ha introduït una de les propostes clau del seu grup: el ""principi de sostenibilitat demogràfica""","Andorra la VellaEl grup parlamentari de l'oposició, Concòrdia, ha presentat avui en roda de premsa les seves esmenes a la llei òmnibus, amb crítiques contundents a la gestió del Govern. Cerni Escalé  ha destacat que ""la principal irresponsabilitat ha estat del Govern"" per anunciar mesures de forma anticipada, fet que, segons ell, ha empitjorat la situació del preu de l'habitatge des de l'abril. 
                                ""Hem de deixar de construir com s'ha fet fins ara i posar fre a la inversió estrangera""
                  Pol Bartolomé, conseller de Concòrdia, ha introduït una de les propostes clau del seu grup: el ""principi de sostenibilitat demogràfica"". Aquesta mesura busca limitar el creixement poblacional del país restringint les autoritzacions de residència que actualment el Govern pot atorgar de manera discrecional. Segons Bartolomé, aquesta restricció és necessària perquè Andorra, tot i tenir una natalitat molt baixa, és un dels països amb més creixement demogràfic. 
                                Habitatge Digne carrega contra l'aliança anti-llei òmnibus
                  Escalé també ha afirmat per part de la inversió estrangera que Concòrdia vol limitar l'adquisició a un sol habitatge de propietat, màxim una segona residència acompanyada d'un límit al nombre de metres quadrats, ""un sistema de quotes que estableixi clarament quins són els metres quadrats que poden entrar al mercat, i proposem un límit de 100.000 metres quadrats per cada any"". A més, Concòrdia proposa canvis en el marc tributari per incentivar una menor especulació immobiliària. Defensen que, durant els primers dos anys després de la compra d'un actiu, es pagui un impost del 25% sobre les plusvàlues, que es reduiria progressivament fins a arribar a zero després de 10 anys. Aquestes esmenes, segons el grup, pretenen aportar més ambició i solucions reals davant de la situació actual.  
                                Concòrdia critica la falta d'ambició de la Llei Òmnibus",,,,,,,,
ara-2024-09-24 16:32:04-En marxa els tràmits per definir l'entorn de protecció de la Casa de la Vall i de l'església de Sant Esteve,2024-09-25 23:35:45.417289,ara,andorra,2024-09-24 16:32:04,societat,article,En marxa els tràmits per definir l'entorn de protecció de la Casa de la Vall i de l'església de Sant Esteve,https://www.ara.ad/societat/marxa-tramits-definir-l-entorn-proteccio-casa-vall-l-esglesia-sant-esteve_1_5149974.html,"La ministra de Cultura, Joventut i Esports, Mònica Bonell, ha destacat que ""respon al compromís del Govern amb la preservació del patrimoni cultural del país""","Andorra la VellaAmb l'objectiu d'assegurar la preservació del patrimoni cultural immoble del Principat i vetllar pel seu manteniment en un entorn adequat, el Govern ha aprovat l'edicte de definició de l'entorn de protecció de la Casa de la Vall i de l'església de Sant Esteve d'Andorra la Vella. Es tracta del segon entorn de protecció que aprova el Govern en aquesta legislatura, després d'haver donat llum verda al referent a l'església de Sant Serni de Nagol. La ministra de Cultura, Joventut i Esports, Mònica Bonell, ha destacat durant la presentació dels entorns que ""respon al compromís del Govern amb la preservació del patrimoni cultural del país i, concretament l'elaboració d'aquells que s'inclouen en la candidatura de la Unesco sobre la configuració del coprincipat"". A més, Bonell ha recordat que la vigent llei del patrimoni cultural recull l'elaboració d'entorns de protecció sobre els béns d'interès cultural (BIC) del país.  L'objectiu de l'aprovació dels entorns és garantir el manteniment de la Casa de la Vall i de l'església de Sant Esteve en un context ambiental adequat i evitar l'afectació dels valors estètics, històrics i culturals dels dos monuments, impedint que se n'alterin les perspectives, la contemplació o l'estudi. Per aquest motiu, s'ha inclòs dintre de l'entorn de protecció, una porció del nucli històric de la parròquia, amb les seves edificacions històriques, carrers i places, tots ells a les immediateses dels dos monuments esmentats. Entrant al detall del document, tal com determina la modificació de la Llei del patrimoni cultural, s'han establert dos zones que regeixen l'entorn de protecció, una d'acompanyament i una altra de preventiva. En aquest sentit, s'ha determinat per a cadascun dels dos monuments la seva pròpia zona d'acompanyament (zona 1). Mentre que, per la proximitat geogràfica dels dos monuments i la seva ubicació dintre d'una mateixa trama urbana, s'ha plantejat la definició de la zona preventiva (zona 2) de forma conjunta, per tal de facilitar la comprensió i la gestió de la zonificació.  D'aquesta manera, respecte a les intervencions que es puguin dur sobre els béns situats en la zona 1, els criteris reverteixen la forma de prescripcions d'obligat compliment i el comú ha d'adaptar el pla d'ordenació i urbanisme parroquial. Pel que fa a la zona 2, s'estableix un perímetre ajustat a les visuals sobre el monument. A partir de la publicació al BOPA d'aquest edicte, s'obre un termini d'exposició pública per a la presentació de possibles al·legacions per part de la ciutadania al ministeri de Cultura, Joventut i Esports i, posteriorment, s'aprovarà el decret corresponent.  La Casa de la Vall és un símbol de la sobirania popular del país en haver estat durant més de tres-cents anys la seu del Consell General. A més, l'edifici disposa d'un gran interès arquitectònic, ja que és l'únic exemple al país de casa senyorial construïda al segle XVI, i també posseeix diversos béns mobles i espais de gran valor, com ara les pintures murals que decoren la sala dels Passos Perduts i la sala del Consell General. Per la seva banda, l'església de Sant Esteve, a banda de ser l'església parroquial d'Andorra la Vella, disposa d'un interès patrimonial, ja que s'hi poden contemplar tres estils arquitectònics d'èpoques diferents: el romànic, l'arquitectura d'època moderna i l'arquitectura del granit. A més, les restes romàniques, el campanar modern i alguns dels elements de la reforma de Puig i Cadafalch a mitjan segle XX han conservat l'aparença i queden integrats en l'edifici contemporani, amb un marcat caràcter eclèctic.",,,,,,,,
